{
  "schema_version": "1.0",
  "document_version": "1.0.0",
  "minimum_runtime_version": "1.0.0",
  "screen_set_id": "FGA03",
  "screen_set_version": "1.0.0",
  "initial_screen": "LAUNCH",
  "screens": [
    {
      "schema_version": "1.0",
      "document_version": "1.0.0",
      "minimum_runtime_version": "1.0.0",
      "id": "LAUNCH",
      "component": "LAUNCH",
      "route": {"mode": "PUBLIC", "pattern": "/"},
      "data_source": "LAST_ROUND_POINTER",
      "onLoad": ["LOAD_SCREEN_MODEL"],
      "onEnter": ["FOCUS_PRIMARY_HEADING", "ANNOUNCE_SCREEN"],
      "onExit": [],
      "actions": [
        {"id": "BEGIN", "handler": "BEGIN"},
        {"id": "RESUME_LAST_ROUND", "handler": "RESUME_LAST_ROUND"}
      ],
      "transitions": [
        {"event": "PATHS_REQUESTED", "target": "PATH_SELECTION", "effect": "NONE", "history": "PUSH"},
        {"event": "ROUND_RESUME_REQUESTED", "target": "INVESTIGATION_BOARD", "effect": "NONE", "history": "REPLACE"}
      ],
      "effects": {"default": "NONE"},
      "validation": {"required_context": []}
    },
    {
      "schema_version": "1.0",
      "document_version": "1.0.0",
      "minimum_runtime_version": "1.0.0",
      "id": "PATH_SELECTION",
      "component": "PATH_SELECTION",
      "route": {"mode": "PUBLIC", "pattern": "/paths"},
      "data_source": "CATALOGUE_SECTIONS",
      "onLoad": ["LOAD_SCREEN_MODEL"],
      "onEnter": ["FOCUS_PRIMARY_HEADING", "ANNOUNCE_SCREEN"],
      "onExit": ["ABORT_OBSOLETE_READS"],
      "actions": [{"id": "SELECT_PATH", "handler": "SELECT_PATH"}],
      "transitions": [{"event": "PATH_SELECTED", "target": "CASE_SELECTION", "effect": "NONE", "history": "PUSH"}],
      "effects": {"default": "NONE"},
      "validation": {"required_context": []}
    },
    {
      "schema_version": "1.0",
      "document_version": "1.0.0",
      "minimum_runtime_version": "1.0.0",
      "id": "CASE_SELECTION",
      "component": "CASE_SELECTION",
      "route": {"mode": "PUBLIC", "pattern": "/paths/:pathId/cases"},
      "data_source": "CATALOGUE_SECTION",
      "onLoad": ["LOAD_SCREEN_MODEL"],
      "onEnter": ["FOCUS_PRIMARY_HEADING", "ANNOUNCE_SCREEN"],
      "onExit": ["ABORT_OBSOLETE_READS"],
      "actions": [
        {"id": "OPEN_CASE", "handler": "OPEN_CASE"},
        {"id": "BACK_TO_PATHS", "handler": "BACK_TO_PATHS"}
      ],
      "transitions": [
        {"event": "CASE_OPENED", "target": "CASE_INTRODUCTION", "effect": "NONE", "history": "PUSH"},
        {"event": "RETURNED_TO_PATHS", "target": "PATH_SELECTION", "effect": "NONE", "history": "PUSH"}
      ],
      "effects": {"default": "NONE"},
      "validation": {"required_context": ["pathId"]}
    },
    {
      "schema_version": "1.0",
      "document_version": "1.0.0",
      "minimum_runtime_version": "1.0.0",
      "id": "CASE_INTRODUCTION",
      "component": "CASE_INTRODUCTION",
      "route": {"mode": "PUBLIC", "pattern": "/rounds/:roundId/intro"},
      "data_source": "ROUND_OPENING",
      "onLoad": ["LOAD_SCREEN_MODEL"],
      "onEnter": ["FOCUS_PRIMARY_HEADING", "ANNOUNCE_SCREEN"],
      "onExit": ["ABORT_OBSOLETE_READS"],
      "actions": [
        {"id": "CHANGE_INTRO_PAGE", "handler": "CHANGE_INTRO_PAGE"},
        {"id": "COMPLETE_INTRO", "handler": "COMPLETE_INTRO"},
        {"id": "SKIP_INTRO", "handler": "SKIP_INTRO"}
      ],
      "transitions": [
        {"event": "INTRO_PAGE_CHANGED", "target": "CASE_INTRODUCTION", "effect": "NONE", "history": "PUSH"},
        {"event": "INTRODUCTION_COMPLETED", "target": "INVESTIGATION_BOARD", "effect": "FADE_TO_BLACK", "history": "REPLACE", "guard": "ROUND_ACTIVE"},
        {"event": "INTRODUCTION_SKIPPED", "target": "INVESTIGATION_BOARD", "effect": "FADE_TO_BLACK", "history": "REPLACE", "guard": "ROUND_ACTIVE"},
        {"event": "INTRODUCTION_ALREADY_COMPLETED", "target": "INVESTIGATION_BOARD", "effect": "NONE", "history": "REPLACE", "guard": "ROUND_ACTIVE"}
      ],
      "effects": {"default": "NONE"},
      "validation": {"required_context": ["roundId"]}
    },
    {
      "schema_version": "1.0",
      "document_version": "1.0.0",
      "minimum_runtime_version": "1.0.0",
      "id": "INVESTIGATION_BOARD",
      "component": "INVESTIGATION_BOARD",
      "route": {"mode": "PUBLIC", "pattern": "/rounds/:roundId/board"},
      "data_source": "ROUND_WORKSPACE",
      "onLoad": ["LOAD_SCREEN_MODEL"],
      "onEnter": ["FOCUS_PRIMARY_HEADING", "ANNOUNCE_SCREEN"],
      "onExit": ["ABORT_OBSOLETE_READS"],
      "actions": [{"id": "RETURN_TO_CATALOGUE", "handler": "RETURN_TO_CATALOGUE"}],
      "transitions": [
        {"event": "RETURNED_TO_CATALOGUE", "target": "CASE_SELECTION", "effect": "NONE", "history": "PUSH"},
        {"event": "INTRODUCTION_REQUIRED", "target": "CASE_INTRODUCTION", "effect": "NONE", "history": "REPLACE", "guard": "ROUND_INTRO_PENDING"}
      ],
      "effects": {"default": "NONE"},
      "validation": {"required_context": ["roundId"]}
    },
    {
      "schema_version": "1.0",
      "document_version": "1.0.0",
      "minimum_runtime_version": "1.0.0",
      "id": "CASE_RESOLUTION",
      "component": "CASE_RESOLUTION",
      "route": {"mode": "INTERNAL", "pattern": null},
      "data_source": "RESOLUTION_CONTEXT",
      "onLoad": [],
      "onEnter": [],
      "onExit": [],
      "actions": [],
      "transitions": [],
      "effects": {"default": "NONE"},
      "validation": {"required_context": []}
    }
  ]
}
